{
	"id": "pkg-wf-contract-core-restored-v-20260312020635-578b03",
	"workflow_id": "wf-contract-core-restored",
	"workflow_name": "Contract Processing Pipeline",
	"workflow_version": "v-20260312020635-578b03",
	"activated_at": "2026-03-12T02:06:35.260Z",
	"authoring_source": {
		"workflow_definition_id": "wf-contract-core-restored",
		"updated_at": "2026-03-12T02:06:26.127Z"
	},
	"execution_topology": "sequential-hitl",
	"mode_policy": {
		"mode": "simulated",
		"supported_modes": ["simulated", "live"]
	},
	"model_policy": {
		"primary_model": "gpt-5.4",
		"fallback_model": "gpt-4o-mini",
		"emergency_model": "gpt-4o-mini"
	},
	"hitl_policy": {
		"enabled": true,
		"reviewer_role": "legal-reviewer",
		"timeout_hours": 24,
		"escalation_email": "legal-review@company.com",
		"checkpoints": ["approval"]
	},
	"manifest_references": [
		"config/workflows/contract-processing.yaml",
		"config/schemas/workflow-package.json",
		"config/stages/contract-lifecycle.json"
	],
	"policy_references": ["data/policies/contract_policies.json", "data/policies.json", "data/clauses.json"],
	"contract_stage_map": {
		"catalog_reference": "config/stages/contract-lifecycle.json",
		"stages": [
			{
				"id": "request-initiation",
				"order": 1,
				"name": "Request and Initiation",
				"summary": "Establishes contract type, completeness, and routing context.",
				"primary_mcp_affinity": ["intake", "workflow"],
				"mvp_shape": "Single group with optional validation branch",
				"notes": "Intake agent plus metadata validation agent.",
				"default_execution_group_name": "Request Initiation Group",
				"execution_groups": [
					{
						"id": "group-request-initiation",
						"name": "Request Initiation Group",
						"runtime_agent_ids": ["intake-1"],
						"runtime_role_keys": ["intake"],
						"primary_mcp_affinity": ["intake", "workflow"]
					}
				]
			},
			{
				"id": "authoring-drafting",
				"order": 2,
				"name": "Authoring and Drafting",
				"summary": "Creates the draft package and recommends approved clause language.",
				"primary_mcp_affinity": ["extraction", "workflow"],
				"mvp_shape": "Parallelizable pair",
				"notes": "Drafting agent plus clause recommendation agent.",
				"default_execution_group_name": "Drafting Group",
				"execution_groups": [
					{
						"id": "group-authoring-drafting",
						"name": "Drafting Group",
						"runtime_agent_ids": ["extraction-1"],
						"runtime_role_keys": ["extraction"],
						"primary_mcp_affinity": ["extraction", "workflow"]
					}
				]
			},
			{
				"id": "internal-review",
				"order": 3,
				"name": "Internal Review",
				"summary": "Summarizes changes and evaluates redlines before broader routing.",
				"primary_mcp_affinity": ["extraction", "audit"],
				"mvp_shape": "Parallelizable pair",
				"notes": "Redline analysis agent plus version-diff agent.",
				"default_execution_group_name": "Internal Review Group",
				"execution_groups": []
			},
			{
				"id": "compliance-check",
				"order": 4,
				"name": "Compliance Check",
				"summary": "Produces policy exceptions and regulatory findings.",
				"primary_mcp_affinity": ["compliance"],
				"mvp_shape": "Parallelizable pair",
				"notes": "Policy mapping agent plus regulatory review agent.",
				"default_execution_group_name": "Compliance Group",
				"execution_groups": [
					{
						"id": "group-compliance-check",
						"name": "Compliance Group",
						"runtime_agent_ids": ["compliance-1"],
						"runtime_role_keys": ["compliance"],
						"primary_mcp_affinity": ["compliance"]
					}
				]
			},
			{
				"id": "negotiation-external-review",
				"order": 5,
				"name": "Negotiation and External Review",
				"summary": "Analyzes counterparty changes and recommends fallback language.",
				"primary_mcp_affinity": ["compliance", "workflow"],
				"mvp_shape": "Sequential pair",
				"notes": "Counterparty change analysis agent plus fallback recommendation agent.",
				"default_execution_group_name": "Negotiation Group",
				"execution_groups": []
			},
			{
				"id": "approval-routing",
				"order": 6,
				"name": "Approval Routing",
				"summary": "Finalizes the approver path and enforces HITL checkpoints.",
				"primary_mcp_affinity": ["workflow", "audit"],
				"mvp_shape": "Sequential plus HITL",
				"notes": "Routing agent plus escalation agent.",
				"default_execution_group_name": "Approval Routing Group",
				"execution_groups": [
					{
						"id": "group-approval-routing",
						"name": "Approval Routing Group",
						"runtime_agent_ids": ["approval-1"],
						"runtime_role_keys": ["approval"],
						"primary_mcp_affinity": ["workflow", "audit"]
					}
				]
			},
			{
				"id": "execution-signature",
				"order": 7,
				"name": "Execution and Signature",
				"summary": "Tracks signature progress, reminders, and completion evidence.",
				"primary_mcp_affinity": ["workflow", "audit"],
				"mvp_shape": "Sequential pair",
				"notes": "Signature orchestration agent plus reminder agent.",
				"default_execution_group_name": "Execution Group",
				"execution_groups": []
			},
			{
				"id": "post-execution-obligations",
				"order": 8,
				"name": "Post-Execution and Obligations",
				"summary": "Converts final terms into tracked obligations and owners.",
				"primary_mcp_affinity": ["extraction", "workflow"],
				"mvp_shape": "Sequential pair",
				"notes": "Obligation extraction agent plus task assignment agent.",
				"default_execution_group_name": "Obligations Group",
				"execution_groups": []
			},
			{
				"id": "renewal-expiry",
				"order": 9,
				"name": "Renewal and Expiry",
				"summary": "Surfaces renewal risk before deadlines are missed.",
				"primary_mcp_affinity": ["drift", "workflow"],
				"mvp_shape": "Parallelizable pair",
				"notes": "Renewal detection agent plus alert prioritization agent.",
				"default_execution_group_name": "Renewal Group",
				"execution_groups": []
			},
			{
				"id": "analytics",
				"order": 10,
				"name": "Analytics",
				"summary": "Turns execution evidence into operational and executive insights.",
				"primary_mcp_affinity": ["eval", "feedback", "audit"],
				"mvp_shape": "Sequential pair",
				"notes": "Reporting agent plus insight summarization agent.",
				"default_execution_group_name": "Analytics Group",
				"execution_groups": []
			}
		],
		"unmapped_agent_ids": []
	},
	"agents": [
		{
			"id": "intake-1",
			"name": "Intake Agent",
			"role": "Classify contracts and extract metadata",
			"kind": "agent",
			"stage": 0,
			"lane": 0,
			"order": 0,
			"model": "gpt-5.4",
			"tools": ["upload_contract", "classify_document", "extract_metadata"],
			"boundary": "Classify only",
			"output": "Contract metadata",
			"runtime_role_key": "intake",
			"declarative": {
				"agent_config": "config/agents/intake-agent.yaml",
				"prompt": "prompts/intake-system.md",
				"output_schema": "config/schemas/intake-result.json"
			}
		},
		{
			"id": "extraction-1",
			"name": "Extraction Agent",
			"role": "Extract clauses, parties, dates, and values",
			"kind": "agent",
			"stage": 1,
			"lane": 0,
			"order": 1,
			"model": "gpt-5.4",
			"tools": ["extract_clauses", "identify_parties", "extract_dates_values"],
			"boundary": "Extraction only",
			"output": "Structured clause data",
			"runtime_role_key": "extraction",
			"declarative": {
				"agent_config": "config/agents/extraction-agent.yaml",
				"prompt": "prompts/extraction-system.md",
				"output_schema": "config/schemas/extraction-result.json"
			}
		},
		{
			"id": "compliance-1",
			"name": "Compliance Agent",
			"role": "Check policies and flag risk",
			"kind": "agent",
			"stage": 2,
			"lane": 0,
			"order": 2,
			"model": "gpt-5.4",
			"tools": ["check_policy", "flag_risk", "get_policy_rules"],
			"boundary": "Compliance only",
			"output": "Risk findings",
			"runtime_role_key": "compliance",
			"declarative": {
				"agent_config": "config/agents/compliance-agent.yaml",
				"prompt": "prompts/compliance-system.md",
				"output_schema": "config/schemas/compliance-result.json"
			}
		},
		{
			"id": "approval-1",
			"name": "Approval Agent",
			"role": "Route approvals and escalate when required",
			"kind": "human",
			"stage": 3,
			"lane": 0,
			"order": 3,
			"model": "gpt-5.4",
			"tools": ["route_approval", "escalate_to_human", "notify_stakeholder"],
			"boundary": "Approval only",
			"output": "Approval decision",
			"runtime_role_key": "approval",
			"declarative": {
				"agent_config": "config/agents/approval-agent.yaml",
				"prompt": "prompts/approval-system.md",
				"output_schema": "config/schemas/approval-result.json"
			}
		}
	]
}
